CompanyName,ARR,EBITDA_Margin,RevenueGrowth,NRR,GRR,CustomerConcentration,CAC_LTV_Ratio,MarketPositionScore,TAM_Score,VerticalFocusScore,LeadershipScore,ProductInnovationScore,ContractVisibilityScore,FinancialQualityScore,CashFlowScore,ScalabilityScore,TechnicalDebtScore,Website,CompanyActivity,FounderName,FounderLinkedIn,MarketPotentialNotes,SynergiesNotes,ExitPotentialNotes
"Apex Cloud",8500000,0.18,0.55,1.22,0.96,0.06,5.2,8,8,0,8,7,8,8,7,9,3,"https://apexcloud.io","Cloud cost optimization platform","Sarah Chen","https://linkedin.com/in/sarahchen","Growing cloud spend offers large TAM, competitive space though.","Integrates with monitoring tools, potential cost savings synergy for acquirer portfolio.","Attractive to larger cloud management players or PE."
"Beta Systems",1200000,0.02,0.80,1.10,0.88,0.25,3.0,6,7,6,7,8,6,7,4,6,6,"https://betasys.com","Workflow automation for legal teams","Ben Carter","","Niche legal tech market growing, needs strong sales execution.","Limited synergy outside legal tech unless platform is adaptable.","Likely tuck-in for larger legal tech or vertical SaaS player."
"Core Logic AI",25000000,-0.05,0.65,1.30,0.94,0.09,4.1,7,9,0,7,9,7,7,5,8,4,"https://corelogic.ai","AI-driven customer sentiment analysis","David Lee","https://linkedin.com/in/davidleeai","Huge market for customer insights, AI differentiation is key.","High synergy potential with CRM, marketing automation, and customer support platforms.","Potential for large strategic acquisition if AI tech is strong."
"Delta Flow",4000000,0.10,0.40,1.08,0.91,0.15,3.5,7,6,8,7,6,7,8,6,7,5,"https://deltaflow.co","Data pipeline tools for financial services","Diana Prince","https://linkedin.com/in/dianaprince","Regulated industry requires specialized tools, high barrier to entry.","Strong synergy within Fintech portfolio, compliance features valuable.","Niche acquisition by financial data providers or larger Fintechs."
"Echo AI",950000,-0.15,1.10,1.15,0.90,0.05,2.8,6,8,7,6,8,5,6,3,6,7,"https://echoai.tech","AI transcription and summarization API","Ethan Hunt","","Rapidly growing market, but many competitors emerging (some large).","Technology synergy if AI models are efficient and accurate, can be embedded.","Acqui-hire potential or feature integration buy."
"Fusion Data",18000000,0.22,0.35,1.12,0.98,0.12,6.0,8,7,0,9,7,9,9,8,8,2,"https://fusiondata.com","Enterprise data catalog and governance","Fiona Glenanne","https://linkedin.com/in/fionaglen","Data governance becoming critical, solid enterprise contracts.","Strong synergy with data warehouses, analytics platforms, cloud providers.","Attractive to large enterprise software vendors or data players."
"Gamma Secure",6000000,0.08,0.50,1.05,0.89,0.20,3.3,7,7,8,7,7,6,7,5,7,4,"https://gammasec.net","API security testing platform","George Kirk","https://linkedin.com/in/georgekirk","Growing API economy drives need, but requires constant innovation.","Synergy with DevOps, CI/CD, and broader security platforms.","Acquisition by application security or DevOps companies likely."
"Horizon Metrics",30000000,0.15,0.48,1.18,0.95,0.07,4.8,8,8,0,8,8,8,8,7,8,3,"https://horizonmet.com","Product analytics suite","Helen Troy","https://linkedin.com/in/helentroy","Large market, competes with established players. Needs strong GTM.","Synergy with marketing automation, CRM, and experimentation platforms.","Could be PE target or strategic acquisition by larger SaaS."
"Infra Ops",550000,0.00,0.95,1.20,0.92,0.10,3.1,6,7,0,6,7,5,6,4,6,5,"https://infraops.dev","Simplified Kubernetes deployment tool","Ian Droi","","Developer tools market is large but fragmented. Needs community adoption.","Synergy with cloud providers, PaaS platforms, DevOps toolchains.","Early stage, likely tuck-in or acqui-hire unless significant traction builds."
"Jupiter Sales",11000000,0.12,0.60,1.28,0.93,0.14,4.5,7,8,6,8,7,7,8,6,7,4,"https://jupitersales.io","Sales engagement platform with AI coaching","Jack Harkness","https://linkedin.com/in/jackharkness","Hot market for sales tech, AI coaching is differentiating.","High synergy with CRM platforms (Salesforce, Hubspot).","Strong candidate for acquisition by CRM giants or sales tech consolidators."
"Kilo CRM",750000,-0.20,0.70,1.00,0.86,0.30,2.5,5,6,0,6,6,6,5,3,5,6,"https://kilocrm.app","Low-cost CRM for freelancers","Kara Thrace","https://linkedin.com/in/karathrace","Price sensitive market, high churn risk, needs volume.","Limited synergy with enterprise tools, potential fit with freelancer marketplaces.","Challenging exit, needs strong user growth for small acquisition."
"Lambda Health",9000000,0.16,0.42,1.16,0.97,0.09,5.5,8,8,9,9,7,8,8,8,8,2,"https://lambda.health","Patient communication platform for hospitals","Leonard McCoy","https://linkedin.com/in/leonardmccoy","Healthcare comms essential, sticky customers, compliance critical.","Strong synergy within healthcare IT portfolio, potential EMR integration.","Attractive to large Health IT vendors or PE focused on healthcare."
"Meta Process",20000000,0.19,0.38,1.14,0.95,0.10,4.9,8,7,7,8,8,7,9,7,8,4,"https://metaproc.com","Business Process Management (BPM) suite","Michael Burnham","https://linkedin.com/in/michaelburnham","Mature market, requires strong enterprise sales and feature set.","Synergy with ERP, RPA, and low-code platforms.","Acquisition by large enterprise software co or PE roll-up."
"Nova Connect",2800000,0.03,0.58,1.09,0.90,0.16,3.7,6,7,0,7,7,7,7,5,7,5,"https://novaconnect.io","Internal communication tool for remote companies","Nyota Uhura","","Crowded market (Slack, Teams), needs clear value prop.","Limited synergy unless offering unique features (e.g., specific integrations).","Difficult standalone exit, possible small acquisition for features/team."
"Omega Finance",45000000,0.25,0.30,1.07,0.99,0.05,6.5,9,7,9,9,7,9,9,9,9,1,"https://omegafin.com","Core banking system modernization platform","Odo Finance","https://linkedin.com/in/odofinance","Critical infrastructure for banks, high switching costs, long sales cycles.","High value synergy for financial services consultancies or core system providers.","Likely large, strategic acquisition by major financial tech/consulting firm."
"Pivot Grid",1500000,-0.08,0.85,1.13,0.87,0.28,2.9,6,6,0,6,8,5,6,4,6,7,"https://pivotgrid.app","No-code internal tool builder","Pavel Chekov","https://linkedin.com/in/pavelchekov","Rapidly growing low-code/no-code space, intense competition.","Synergy potential with database platforms, workflow tools, cloud providers.","Needs significant user growth or unique tech for good exit."
"Quantum Leap AI",6500000,-0.01,0.72,1.24,0.93,0.08,4.0,7,8,7,7,9,6,7,5,7,4,"https://quantumleap.ai","AI for predictive maintenance in manufacturing","Quark Ferengi","","Strong ROI potential for customers, requires domain expertise.","Synergy with IoT platforms, manufacturing execution systems (MES).","Strategic acquisition by industrial IoT players or large manufacturers."
"Raptor AI",33000000,0.14,0.50,1.20,0.96,0.13,5.1,8,8,0,8,8,8,8,7,8,3,"https://raptorai.com","AI-powered cybersecurity threat detection","Reg Barclay","https://linkedin.com/in/regbarclay","Cybersecurity always in demand, AI is key differentiator but needs efficacy.","High synergy with endpoint security, SIEM, and other security vendors.","Strong potential for large security vendor acquisition or PE interest."
"Sigma Suite",13000000,0.17,0.33,1.06,0.92,0.19,4.3,7,7,8,7,6,7,7,6,7,5,"https://sigmasuite.com","Compliance management for Life Sciences","Samantha Carter","https://linkedin.com/in/samanthacarter","High compliance burden in Life Sci drives need, sticky product.","Strong vertical synergy for Life Science tech acquirers.","Acquisition by vertical SaaS consolidator or large pharma tech provider."
"Terra Flow",8000000,0.06,0.68,1.19,0.94,0.07,4.0,7,7,0,7,7,7,8,6,8,4,"https://terraflow.io","Data integration platform (iPaaS), SMB focus","T'Pol Vulcan","","Large iPaaS market, competing with giants (Zapier, MuleSoft). SMB focus is differentiator.","Synergy with SMB SaaS tools (accounting, CRM, marketing).","Potential acquisition by larger iPaaS or SMB SaaS suite vendor."
"Unity Base",1000000,-0.12,0.99,1.11,0.89,0.12,3.2,6,7,0,6,7,6,6,4,6,6,"https://unitybase.dev","Developer collaboration platform","Una Chin-Riley","https://linkedin.com/in/unachinriley","Competitive space (GitHub, GitLab), needs unique angle.","Synergy with CI/CD, cloud hosting, project management tools.","Acquisition for community/users or unique features."
"Vertex AI Labs",22000000,0.10,0.52,1.21,0.95,0.10,4.7,8,9,7,8,9,7,8,6,8,3,"https://vertexai.labs","MLOps platform for model deployment and monitoring","Valeris Vulcan","","Growing MLOps market, complex tech area needs expertise.","High synergy with cloud providers (AWS, GCP, Azure), AI platforms.","Strong candidate for acquisition by cloud giants or AI platform companies."
"Wave Analytics",5000000,0.13,0.39,1.04,0.90,0.21,3.6,7,6,6,7,6,7,7,6,7,5,"https://waveanalytics.com","Website analytics focused on privacy","Worf SonOfMogh","","Privacy focus is timely differentiator, but challenges Google Analytics dominance.","Limited direct synergy, potential interest from privacy-focused tech players.","Niche acquisition target, needs strong user base or unique tech."
"Xeno Core",16000000,0.21,0.31,1.09,0.97,0.08,5.8,8,7,0,9,7,8,9,8,9,2,"https://xenocore.com","Headless CMS and digital experience platform","Xehanort Master","https://linkedin.com/in/xehanort","Modern architecture appeals to developers, competitive DXP market.","Synergy with marketing tech, e-commerce platforms, CDPs.","Attractive to large digital experience vendors or PE."
"Yield Pro",2500000,-0.03,0.78,1.17,0.91,0.17,3.9,6,7,8,7,7,6,7,5,7,4,"https://yieldpro.ag","Farm management software with yield prediction","Yoda Jedi","","AgriTech growing, data crucial. Requires trust and adoption by farmers.","Synergy with farming equipment manufacturers, agricultural data providers.","Acquisition by large AgriTech player or agricultural conglomerate."
"Zenith Ops",19000000,0.11,0.44,1.10,0.94,0.16,4.4,7,7,0,8,7,7,8,7,8,5,"https://zenithops.cloud","IT service management (ITSM) platform","Zefram Cochrane","https://linkedin.com/in/zeframcochrane","Large, stable ITSM market. Competes with ServiceNow, Atlassian.","Synergy with IT monitoring, asset management, endpoint management tools.","PE interest likely, potential acquisition by larger IT management vendor."
"Alpha Stream",3100000,0.10,0.25,1.08,0.96,0.15,4.2,6,7,8,7,6,7,7,7,8,3,"https://alphastream-example.com","Financial data streaming and analysis","Sarah Jones","https://linkedin.com/in/sarahjones-example","Stable niche, potential competition from larger data providers.","Good synergy with trading platforms or financial news services.","Likely acquisition by financial data aggregator or specialized firm."
"Blue Sky Solutions",9800000,0.18,0.40,1.15,0.97,0.07,4.8,8,8,0,8,7,8,8,8,9,2,"https://bluesky-example.com","DevOps automation and monitoring","David Rodriguez","https://linkedin.com/in/davidrodriguez-example","Core DevOps tool, strong demand, but rapid tech evolution.","High synergy with cloud platforms and other DevOps toolchain vendors.","Good acquisition target for larger DevOps or cloud management company."
"Cloud Nine Inc.",2200000,-0.15,0.70,1.28,0.85,0.20,2.8,6,7,0,6,8,4,6,3,6,7,"https://cloudnine-example.net","Social media management suite, SMB focus","Olivia White","","Crowded market, differentiation is key, SMB churn can be high.","Synergy with other SMB marketing tools or website builders.","Challenging exit, potentially small acquisition for user base."
"Data Forge",18000000,0.12,0.30,1.12,0.94,0.11,4.1,7,7,6,7,7,7,7,6,7,4,"https://dataforge-example.com","Data preparation and cleansing tool, enterprise scale","Raj Patel","https://linkedin.com/in/rajpatel-example","Essential part of data pipeline, growing need with AI/ML.","Strong synergy with ETL, data warehousing, and analytics platforms.","Good acquisition target for major data platform vendors."